{
  "id": "tx-fort-worth-beth-eden-missionary-baptist",
  "name": "Beth Eden Missionary Baptist Church",
  "address": {
    "street": "3208 Wilbarger St",
    "city": "Fort Worth",
    "state": "TX",
    "zip": "76119"
  },
  "lat": 32.69965,
  "lng": -97.27836,
  "phone": "817-534-0283",
  "hours": [
    {
      "day": "tue",
      "open": "09:00",
      "close": "11:00"
    }
  ],
  "hoursNotes": "Weekly Tuesday distribution began December 2025.",
  "services": [
    "food-pantry"
  ],
  "affiliation": "Baptist",
  "lastVerified": "2025-11-08",
  "sourceUrl": "https://www.reddit.com/r/FortWorth/comments/1os3xwm/lots_of_folks_asking_for_food_bank_information/"
}
