{
  "id": "tx-fort-worth-4-saints-episcopal-food-pantry",
  "name": "4 Saints Episcopal Food Pantry",
  "address": {
    "street": "2529 Mt View Ave",
    "city": "Fort Worth",
    "state": "TX",
    "zip": "76103"
  },
  "lat": 32.74293,
  "lng": -97.26765,
  "phone": "817-609-4122",
  "website": "https://4saintsfood.org/",
  "hours": [
    {
      "day": "fri",
      "open": "11:00",
      "close": "13:00"
    }
  ],
  "hoursNotes": "Fridays, excluding major holidays.",
  "services": [
    "food-pantry"
  ],
  "affiliation": "Episcopal",
  "lastVerified": "2025-11-08",
  "sourceUrl": "https://www.reddit.com/r/FortWorth/comments/1os3xwm/lots_of_folks_asking_for_food_bank_information/"
}
