{
  "id": "tx-dallas-the-harmony-food-pantry",
  "name": "The Harmony Food Pantry",
  "address": {
    "street": "6969 Pastor Bailey Dr",
    "street2": "Suite 300",
    "city": "Dallas",
    "state": "TX",
    "zip": "75237"
  },
  "lat": 32.67167,
  "lng": -96.8743,
  "hours": [
    {
      "day": "mon",
      "open": "13:00",
      "close": "17:00"
    },
    {
      "day": "tue",
      "open": "15:00",
      "close": "17:30"
    },
    {
      "day": "wed",
      "open": "10:00",
      "close": "14:00"
    },
    {
      "day": "thu",
      "open": "10:00",
      "close": "14:00"
    }
  ],
  "services": [
    "food-pantry"
  ],
  "lastVerified": "2025-11-08",
  "sourceUrl": "https://www.reddit.com/r/FortWorth/comments/1os3xwm/lots_of_folks_asking_for_food_bank_information/"
}
